{
  "$schema": "../schemas/revans-and-apex.schema.json",
  "version": "2.0.0",
  "generatedAt": "2026-10-13T08:34:00.000Z",
  "description": "High-difficulty raid mechanics, HP triggers, and omen cancel conditions for Magna 3, Revans, and Apex raids.",
  "categories": [
    {
      "categoryId": "magna_3_omega_rebirth",
      "categoryName": "Magna 3 (Omega Rebirth) Series",
      "raids": [
        {
          "raidId": "colossus_ira",
          "name": "Colossus Ira Omega",
          "element": "Fire",
          "battleSystem": "V2",
          "maxPlayers": 18,
          "totalHp": "850,000,000",
          "mechanicsSummary": "High defense with heat dissipation phases. Omens demand high hit-counts and water multi-hit skills. Guarding reduces heat vents.",
          "hpPhases": [
            {
              "phaseName": "Thermal Core Phase 1 (100%-50%)",
              "hpRange": "100%-50%",
              "omensAndTriggers": [
                {
                  "triggerType": "HP_Trigger",
                  "name": "Magma Core Overdrive (75%)",
                  "cancelCondition": "Deal 30,000,000 damage or 35 hits",
                  "penaltyIfUncanceled": "Deals massive fire plain damage and inflicts Burn (5000/turn)",
                  "mitigationNotes": "Clear with Payila 4-hit normal attacks or Haaselia skill spam."
                }
              ]
            },
            {
              "phaseName": "Meltdown Phase 2 (50%-0%)",
              "hpRange": "50%-0%",
              "omensAndTriggers": [
                {
                  "triggerType": "HP_Trigger",
                  "name": "Dimensional Cleave: Ira (25%)",
                  "cancelCondition": "Deal 4 Charge Attacks or 40 hits",
                  "penaltyIfUncanceled": "Instantly defeats targeted ally (ignores normal defense)",
                  "mitigationNotes": "Use Vajra double Ougi or Poseidon substitute."
                }
              ]
            }
          ],
          "recommendedClasses": [
            "Manadiver",
            "Kengo",
            "Paladin"
          ],
          "teamTemplates": [
            {
              "templateName": "Water Kengo Ougi Loop",
              "mcClass": "Kengo (Kaneshige)",
              "keyCharacters": [
                "Vajra",
                "Haaselia (FLB)",
                "Poseidon"
              ],
              "strategySummary": "Maintain 200% charge bar chains to clear damage and Ougi omens effortlessly on Full Auto."
            }
          ]
        },
        {
          "raidId": "tiamat_aura",
          "name": "Tiamat Aura Omega",
          "element": "Wind",
          "battleSystem": "V2",
          "maxPlayers": 18,
          "totalHp": "850,000,000",
          "mechanicsSummary": "Spawns storm barriers that nullify non-critical damage. Relies on 100% crit grids and fire burst rotations to shred barriers.",
          "hpPhases": [
            {
              "phaseName": "Tempest Barrier Phase (100%-50%)",
              "hpRange": "100%-50%",
              "omensAndTriggers": [
                {
                  "triggerType": "HP_Trigger",
                  "name": "Aerial Jail (80%)",
                  "cancelCondition": "Deal 25,000,000 damage with critical hits",
                  "penaltyIfUncanceled": "Imprisons frontline allies in Aerial Jail (unable to act for 2 turns)",
                  "mitigationNotes": "Ensure 100% critical grid active before pushing 80%."
                }
              ]
            },
            {
              "phaseName": "Vortex Hurricane (50%-0%)",
              "hpRange": "50%-0%",
              "omensAndTriggers": [
                {
                  "triggerType": "HP_Trigger",
                  "name": "Supercell Burst (20%)",
                  "cancelCondition": "Cast 4 Skills or 36 hits",
                  "penaltyIfUncanceled": "Teamwide 30,000 plain damage and buff wipe",
                  "mitigationNotes": "Save Percival Sk2 and Zeta nukes to cancel instantly."
                }
              ]
            }
          ],
          "recommendedClasses": [
            "Berserker",
            "Sumaibito",
            "Relic Buster"
          ],
          "teamTemplates": [
            {
              "templateName": "Fire Percival Burst",
              "mcClass": "Sumaibito",
              "keyCharacters": [
                "Percival (Grand)",
                "Michael",
                "Zeta (Grand)"
              ],
              "strategySummary": "Turn 1 Percival 3 Tri-Strike obliterates boss HP; cancels all initial omens with massive raw burst."
            }
          ]
        }
      ]
    },
    {
      "categoryId": "revans_series",
      "categoryName": "Revans Impossible Series (6-Man)",
      "raids": [
        {
          "raidId": "revans_diaspora",
          "name": "Diaspora",
          "element": "Water",
          "battleSystem": "V2",
          "maxPlayers": 6,
          "totalHp": "2,000,000,000",
          "mechanicsSummary": "Two distinct phases: Phase 1 (Activation sequence: α-hit count, β-skill damage, or γ-charge attack damage). Raid groups universally run '100% γ' to ensure smooth Phase 2 transitions. Phase 2 (Emergency Repair / Cell Death) triggers relentless 36-hit or 99-hit omens.",
          "hpPhases": [
            {
              "phaseName": "Phase 1: Activation Analysis (100%-State 100)",
              "hpRange": "100%-100%",
              "omensAndTriggers": [
                {
                  "triggerType": "Turn_Trigger",
                  "name": "Gamma Absorption Protocol",
                  "cancelCondition": "Deal 30,000,000 CA damage in a single turn",
                  "penaltyIfUncanceled": "Ramps α or β counter if non-CA damage is dealt",
                  "mitigationNotes": "Earth Kengo Ougi setup exclusively attacks with charge attacks until γ reaches 100."
                }
              ]
            },
            {
              "phaseName": "Phase 2: Cell Death Overdrive",
              "hpRange": "100%-0%",
              "omensAndTriggers": [
                {
                  "triggerType": "HP_Trigger",
                  "name": "Annihilation Ray (30%)",
                  "cancelCondition": "Deal 36 hits or 3,000,000 plain damage",
                  "penaltyIfUncanceled": "Instant team wipe",
                  "mitigationNotes": "Hrunting plain nuke or Caim 3-turn skill copy cancels this instantly."
                }
              ]
            }
          ],
          "recommendedClasses": [
            "Kengo (Phase 1 Host)",
            "Robin Hood / Berserker (Phase 2 Leech/Race)"
          ],
          "teamTemplates": [
            {
              "templateName": "Earth Kengo 100% Gamma Host",
              "mcClass": "Kengo (Kaneshige)",
              "keyCharacters": [
                "Satyr (Earth)",
                "Okuninushi",
                "Arulumaya"
              ],
              "strategySummary": "Charge attack every turn to charge γ to 100, then open raid backup for Robin Hood bursters to clear Phase 2 in seconds."
            }
          ]
        },
        {
          "raidId": "revans_seofon",
          "name": "Seofon",
          "element": "Wind",
          "battleSystem": "V2",
          "maxPlayers": 6,
          "totalHp": "2,500,000,000",
          "mechanicsSummary": "Blue Chest guaranteed at 4,000,000 Honors (~400,000,000 damage). Entry trigger deals 999,999 plain damage to non-Fire allies and locks all summon cooldowns to 99 turns. Almost all cancelable omens (Emblema, Cien Mil Espadas, Infinito Creare, Cinco Mil Espadas) require 77,777,777 single-turn damage (or Fatal Chain for Cien Mil Espadas). Uncanceled triggers grant Espada (Spirit Sword) stacks.",
          "hpPhases": [
            {
              "phaseName": "Phase 1: Opening Sword Stance (100%-50%)",
              "hpRange": "100%-50%",
              "omensAndTriggers": [
                {
                  "triggerType": "Charge_Diamond",
                  "name": "Emblema (Charge Diamond Max)",
                  "cancelCondition": "Deal 77,777,777 damage in a single turn",
                  "penaltyIfUncanceled": "Massive Wind multi-hit damage, gains 1 Espada stack, and fills enemy FC gauge",
                  "mitigationNotes": "Burst 77.77M damage with Percival Sk3, Alanaan Sk4, or 5-6 chain Ougi turn, or Guard all."
                },
                {
                  "triggerType": "Special",
                  "name": "Cien Mil Espadas (Enemy FC Gauge 100%)",
                  "cancelCondition": "Activate Fatal Chain (FC) or deal 77,777,777 damage",
                  "penaltyIfUncanceled": "Heavy AoE Wind damage, Burn (2000/turn), Skill Seal, and 1 Espada stack",
                  "mitigationNotes": "Hold player Fatal Chain for instant 1-button cancel or burst 77,777,777 damage."
                },
                {
                  "triggerType": "HP_Trigger",
                  "name": "Infinito Creare (80% & 50% HP)",
                  "cancelCondition": "Deal 77,777,777 damage in a single turn",
                  "penaltyIfUncanceled": "Summons 7 Sword Emblems, strips buffs, and deals heavy teamwide Wind damage",
                  "mitigationNotes": "Save Percival (Grand) Sk3 or full Kengo/Wilnas Ougi chain when pushing 80% and 50%."
                }
              ]
            },
            {
              "phaseName": "Phase 2: Seven-Star Overdrive (50%-10%)",
              "hpRange": "50%-10%",
              "omensAndTriggers": [
                {
                  "triggerType": "Charge_Diamond",
                  "name": "Cinco Mil Espadas (Charge Diamond Max)",
                  "cancelCondition": "Deal 77,777,777 damage in a single turn",
                  "penaltyIfUncanceled": "Massive multi-hit Wind damage, ATK Down, Charge Bar -100%, and 1 Espada stack",